Protein id	Contig id	Start	Stop	Strand	Element symbol	Element name	Scope	Type	Subtype	Class	Subclass	Method	Target length	Reference sequence length	% Coverage of reference	% Identity to reference	Alignment length	Closest reference accession	Closest reference name	HMM accession	HMM description
NA	CP014046.2	2540454	2541821	+	norM	multidrug efflux MATE transporter NorM	plus	AMR	AMR	EFFLUX	EFFLUX	BLASTX	456	456	100.00	99.56	456	BAA31456.1	multidrug efflux MATE transporter NorM	NA	NA
NA	CP014046.2	2940722	2942320	-	tet(35)	tetracycline efflux Na+/H+ antiporter family transporter Tet(35)	core	AMR	AMR	TETRACYCLINE	TETRACYCLINE	BLASTX	533	533	100.00	99.62	533	WP_005480402.1	tetracycline efflux Na+/H+ antiporter family transporter Tet(35)	NA	NA
NA	CP014047.2	35993	36559	-	trh2	TDH-related hemolysin TRH2	plus	VIRULENCE	VIRULENCE	NA	NA	BLASTX	189	189	100.00	91.53	189	ALZ44849.1	TDH-related hemolysin TRH2	NA	NA
NA	CP014047.2	971635	972483	+	blaCARB-18	carbenicillin-hydrolyzing class A beta-lactamase CARB-18	core	AMR	AMR	BETA-LACTAM	BETA-LACTAM	ALLELEX	283	283	100.00	100.00	283	WP_005459715.1	carbenicillin-hydrolyzing class A beta-lactamase CARB-18	NA	NA
NA	CP014047.2	1460145	1460801	-	catC	type C chloramphenicol O-acetyltransferase	plus	AMR	AMR	PHENICOL	CHLORAMPHENICOL	BLASTX	219	219	100.00	99.54	219	KGT34314.1	type C chloramphenicol O-acetyltransferase	NA	NA
