Protein id	Contig id	Start	Stop	Strand	Element symbol	Element name	Scope	Type	Subtype	Class	Subclass	Method	Target length	Reference sequence length	% Coverage of reference	% Identity to reference	Alignment length	Closest reference accession	Closest reference name	HMM accession	HMM description
NA	CP014024.2	691011	691649	+	catA3	type A-3 chloramphenicol O-acetyltransferase CatIII	core	AMR	AMR	PHENICOL	CHLORAMPHENICOL	BLASTX	213	213	100.00	99.06	213	WP_004920769.1	type A-3 chloramphenicol O-acetyltransferase CatIII	NA	NA
NA	CP014024.2	984984	985775	+	aadA36	ANT(3'')-I family aminoglycoside nucleotidyltransferase AadA36	core	AMR	AMR	AMINOGLYCOSIDE	SPECTINOMYCIN/STREPTOMYCIN	BLASTX	264	264	100.00	99.24	264	WP_071821194.1	ANT(3'')-I family aminoglycoside nucleotidyltransferase AadA36	NA	NA
NA	CP014024.2	1682765	1683298	-	aac(2')-Ia	aminoglycoside N-acetyltransferase AAC(2')-Ia	core	AMR	AMR	AMINOGLYCOSIDE	GENTAMICIN/PLAZOMICIN/TOBRAMYCIN	EXACTX	178	178	100.00	100.00	178	WP_004918308.1	aminoglycoside N-acetyltransferase AAC(2')-Ia	NA	NA
NA	CP014024.2	3824921	3825496	-	terD	tellurium resistance membrane protein TerD	plus	STRESS	METAL	TELLURIUM	TELLURIUM	BLASTX	192	192	100.00	93.23	192	AAA98292.1	tellurium resistance membrane protein TerD	NA	NA
NA	CP014024.2	4153221	4154423	+	tet(B)	tetracycline efflux MFS transporter Tet(B)	core	AMR	AMR	TETRACYCLINE	TETRACYCLINE	BLASTX	401	401	100.00	99.75	401	WP_001089072.1	tetracycline efflux MFS transporter Tet(B)	NA	NA
