Protein id	Contig id	Start	Stop	Strand	Element symbol	Element name	Scope	Type	Subtype	Class	Subclass	Method	Target length	Reference sequence length	% Coverage of reference	% Identity to reference	Alignment length	Closest reference accession	Closest reference name	HMM accession	HMM description
NA	CP027200.1	4707	5258	+	aac(6')-Ib-cr5	fluoroquinolone-acetylating aminoglycoside 6'-N-acetyltransferase AAC(6')-Ib-cr5	core	AMR	AMR	AMINOGLYCOSIDE/QUINOLONE	AMIKACIN/KANAMYCIN/QUINOLONE/TOBRAMYCIN	ALLELEX	184	184	100.00	100.00	184	WP_063840321.1	fluoroquinolone-acetylating aminoglycoside 6'-N-acetyltransferase AAC(6')-Ib-cr5	NA	NA
NA	CP027200.1	5358	5807	+	arr-3	NAD(+)--rifampin ADP-ribosyltransferase Arr-3	core	AMR	AMR	RIFAMYCIN	RIFAMYCIN	EXACTX	150	150	100.00	100.00	150	WP_001749986.1	NAD(+)--rifampin ADP-ribosyltransferase Arr-3	NA	NA
NA	CP027200.1	5943	6413	+	dfrA27	trimethoprim-resistant dihydrofolate reductase DfrA27	core	AMR	AMR	TRIMETHOPRIM	TRIMETHOPRIM	EXACTX	157	157	100.00	100.00	157	WP_001749985.1	trimethoprim-resistant dihydrofolate reductase DfrA27	NA	NA
NA	CP027200.1	6597	7439	+	aadA16	ANT(3'')-Ia family aminoglycoside nucleotidyltransferase AadA16	core	AMR	AMR	AMINOGLYCOSIDE	STREPTOMYCIN	EXACTX	281	281	100.00	100.00	281	WP_001749984.1	ANT(3'')-Ia family aminoglycoside nucleotidyltransferase AadA16	NA	NA
NA	CP027200.1	7559	7903	+	qacEdelta1	quaternary ammonium compound efflux SMR transporter QacE delta 1	core	STRESS	BIOCIDE	QUATERNARY AMMONIUM	QUATERNARY AMMONIUM	ALLELEX	115	115	100.00	100.00	115	WP_000679427.1	quaternary ammonium compound efflux SMR transporter QacE delta 1	NA	NA
NA	CP027200.1	7900	8736	+	sul1	sulfonamide-resistant dihydropteroate synthase Sul1	core	AMR	AMR	SULFONAMIDE	SULFONAMIDE	EXACTX	279	279	100.00	100.00	279	WP_000259031.1	sulfonamide-resistant dihydropteroate synthase Sul1	NA	NA
NA	CP027200.1	11281	12033	-	rmtB1	16S rRNA (guanine(1405)-N(7))-methyltransferase RmtB1	core	AMR	AMR	AMINOGLYCOSIDE	AMINOGLYCOSIDE	ALLELEX	251	251	100.00	100.00	251	WP_012372818.1	16S rRNA (guanine(1405)-N(7))-methyltransferase RmtB1	NA	NA
NA	CP027200.1	12206	13063	-	blaTEM-1	broad-spectrum class A beta-lactamase TEM-1	core	AMR	AMR	BETA-LACTAM	BETA-LACTAM	ALLELEX	286	286	100.00	100.00	286	WP_000027057.1	broad-spectrum class A beta-lactamase TEM-1	NA	NA
NA	CP027200.1	14596	15453	+	aac(3)-IId	aminoglycoside N-acetyltransferase AAC(3)-IId	core	AMR	AMR	AMINOGLYCOSIDE	GENTAMICIN	EXACTX	286	286	100.00	100.00	286	WP_000557454.1	aminoglycoside N-acetyltransferase AAC(3)-IId	NA	NA
NA	CP027200.1	20428	21285	+	blaTEM-1	broad-spectrum class A beta-lactamase TEM-1	core	AMR	AMR	BETA-LACTAM	BETA-LACTAM	ALLELEX	286	286	100.00	100.00	286	WP_000027057.1	broad-spectrum class A beta-lactamase TEM-1	NA	NA
NA	CP027200.1	21522	22355	-	aph(6)-Id	aminoglycoside O-phosphotransferase APH(6)-Id	core	AMR	AMR	AMINOGLYCOSIDE	STREPTOMYCIN	EXACTX	278	278	100.00	100.00	278	WP_000480968.1	aminoglycoside O-phosphotransferase APH(6)-Id	NA	NA
NA	CP027200.1	22358	23158	-	aph(3'')-Ib	aminoglycoside O-phosphotransferase APH(3'')-Ib	core	AMR	AMR	AMINOGLYCOSIDE	STREPTOMYCIN	BLASTX	267	267	100.00	99.63	267	WP_001082319.1	aminoglycoside O-phosphotransferase APH(3'')-Ib	NA	NA
NA	CP027200.1	23222	24034	-	sul2	sulfonamide-resistant dihydropteroate synthase Sul2	core	AMR	AMR	SULFONAMIDE	SULFONAMIDE	EXACTX	271	271	100.00	100.00	271	WP_001043260.1	sulfonamide-resistant dihydropteroate synthase Sul2	NA	NA
NA	CP027200.1	29919	30389	-	dfrA14	trimethoprim-resistant dihydrofolate reductase DfrA14	core	AMR	AMR	TRIMETHOPRIM	TRIMETHOPRIM	EXACTX	157	157	100.00	100.00	157	WP_004201280.1	trimethoprim-resistant dihydrofolate reductase DfrA14	NA	NA
NA	CP027200.1	34235	35431	+	tet(A)	tetracycline efflux MFS transporter Tet(A)	core	AMR	AMR	TETRACYCLINE	TETRACYCLINE	EXACTX	399	399	100.00	100.00	399	WP_000804064.1	tetracycline efflux MFS transporter Tet(A)	NA	NA
NA	CP027202.2	57874	59496	+	mcr-1.1	phosphoethanolamine--lipid A transferase MCR-1.1	core	AMR	AMR	COLISTIN	COLISTIN	ALLELEX	541	541	100.00	100.00	541	WP_049589868.1	phosphoethanolamine--lipid A transferase MCR-1.1	NA	NA
NA	CP027202.2	70545	71009	-	terW	tellurium resistance protein TerW	plus	STRESS	METAL	TELLURIUM	TELLURIUM	EXACTX	155	155	100.00	100.00	155	AAC44736.1	tellurium resistance protein TerW	NA	NA
NA	CP027202.2	77583	78161	+	terZ	tellurium resistance-associated protein TerZ	plus	STRESS	METAL	TELLURIUM	TELLURIUM	BLASTX	193	193	100.00	98.45	193	AAA86846.1	tellurium resistance-associated protein TerZ	NA	NA
NA	CP027202.2	80911	81486	+	terD	tellurium resistance membrane protein TerD	plus	STRESS	METAL	TELLURIUM	TELLURIUM	BLASTX	192	192	100.00	96.35	192	AAA98292.1	tellurium resistance membrane protein TerD	NA	NA
NA	CP027202.2	97824	99059	-	mrx(A)	phosphorylated macrolide efflux MFS transporter Mrx(A)	core	AMR	AMR	MACROLIDE	AZITHROMYCIN/ERYTHROMYCIN/SPIRAMYCIN/TELITHROMYCIN	EXACTX	412	412	100.00	100.00	412	WP_000004159.1	phosphorylated macrolide efflux MFS transporter Mrx(A)	NA	NA
NA	CP027202.2	99059	99961	-	mph(A)	Mph(A) family macrolide 2'-phosphotransferase	core	AMR	AMR	MACROLIDE	AZITHROMYCIN/ERYTHROMYCIN/SPIRAMYCIN/TELITHROMYCIN	EXACTX	301	301	100.00	100.00	301	WP_000219391.1	Mph(A) family macrolide 2'-phosphotransferase	NA	NA
NA	CP027202.2	107565	109481	+	tet(M)	tetracycline resistance ribosomal protection protein Tet(M)	core	AMR	AMR	TETRACYCLINE	TETRACYCLINE	BLASTX	639	639	100.00	98.75	639	WP_063856397.1	tetracycline resistance ribosomal protection protein Tet(M)	NA	NA
NA	CP027202.2	126603	127799	-	tet(A)	tetracycline efflux MFS transporter Tet(A)	core	AMR	AMR	TETRACYCLINE	TETRACYCLINE	EXACTX	399	399	100.00	100.00	399	WP_000804064.1	tetracycline efflux MFS transporter Tet(A)	NA	NA
NA	CP027202.2	129138	129971	-	aph(6)-Id	aminoglycoside O-phosphotransferase APH(6)-Id	core	AMR	AMR	AMINOGLYCOSIDE	STREPTOMYCIN	EXACTX	278	278	100.00	100.00	278	WP_000480968.1	aminoglycoside O-phosphotransferase APH(6)-Id	NA	NA
NA	CP027202.2	129974	130774	-	aph(3'')-Ib	aminoglycoside O-phosphotransferase APH(3'')-Ib	core	AMR	AMR	AMINOGLYCOSIDE	STREPTOMYCIN	EXACTX	267	267	100.00	100.00	267	WP_001082319.1	aminoglycoside O-phosphotransferase APH(3'')-Ib	NA	NA
NA	CP027202.2	130838	131650	-	sul2	sulfonamide-resistant dihydropteroate synthase Sul2	core	AMR	AMR	SULFONAMIDE	SULFONAMIDE	EXACTX	271	271	100.00	100.00	271	WP_001043260.1	sulfonamide-resistant dihydropteroate synthase Sul2	NA	NA
NA	CP027202.2	131815	132672	-	blaTEM-1	broad-spectrum class A beta-lactamase TEM-1	core	AMR	AMR	BETA-LACTAM	BETA-LACTAM	ALLELEX	286	286	100.00	100.00	286	WP_000027057.1	broad-spectrum class A beta-lactamase TEM-1	NA	NA
NA	CP027202.2	136339	137127	+	aadA22	ANT(3'')-Ia family aminoglycoside nucleotidyltransferase AadA22	core	AMR	AMR	AMINOGLYCOSIDE	STREPTOMYCIN	EXACTX	263	263	100.00	100.00	263	WP_032491824.1	ANT(3'')-Ia family aminoglycoside nucleotidyltransferase AadA22	NA	NA
NA	CP027202.2	137262	138080	+	lnu(F)	lincosamide nucleotidyltransferase Lnu(F)	core	AMR	AMR	LINCOSAMIDE	LINCOSAMIDE	BLASTX	273	273	100.00	99.63	273	WP_000939727.1	lincosamide nucleotidyltransferase Lnu(F)	NA	NA
NA	CP027202.2	140776	141576	+	aph(3'')-Ib	aminoglycoside O-phosphotransferase APH(3'')-Ib	core	AMR	AMR	AMINOGLYCOSIDE	STREPTOMYCIN	EXACTX	267	267	100.00	100.00	267	WP_001082319.1	aminoglycoside O-phosphotransferase APH(3'')-Ib	NA	NA
NA	CP027202.2	141579	142412	+	aph(6)-Id	aminoglycoside O-phosphotransferase APH(6)-Id	core	AMR	AMR	AMINOGLYCOSIDE	STREPTOMYCIN	EXACTX	278	278	100.00	100.00	278	WP_000480968.1	aminoglycoside O-phosphotransferase APH(6)-Id	NA	NA
NA	CP027202.2	142751	143563	+	aph(3')-Ia	aminoglycoside O-phosphotransferase APH(3')-Ia	core	AMR	AMR	AMINOGLYCOSIDE	KANAMYCIN	EXACTX	271	271	100.00	100.00	271	WP_000018321.1	aminoglycoside O-phosphotransferase APH(3')-Ia	NA	NA
NA	CP027202.2	147427	148449	-	aph(4)-Ia	aminoglycoside O-phosphotransferase APH(4)-Ia	core	AMR	AMR	AMINOGLYCOSIDE	HYGROMYCIN	EXACTX	341	341	100.00	100.00	341	WP_000742814.1	aminoglycoside O-phosphotransferase APH(4)-Ia	NA	NA
NA	CP027202.2	148681	149454	-	aac(3)-IVa	aminoglycoside N-acetyltransferase AAC(3)-IVa	core	AMR	AMR	AMINOGLYCOSIDE	APRAMYCIN/GENTAMICIN/TOBRAMYCIN	EXACTX	258	258	100.00	100.00	258	WP_001199192.1	aminoglycoside N-acetyltransferase AAC(3)-IVa	NA	NA
NA	CP027202.2	151206	152417	-	floR	chloramphenicol/florfenicol efflux MFS transporter FloR	core	AMR	AMR	PHENICOL	CHLORAMPHENICOL/FLORFENICOL	BLASTX	404	404	100.00	99.75	404	WP_000214121.1	chloramphenicol/florfenicol efflux MFS transporter FloR	NA	NA
NA	CP027202.2	162180	163052	-	blaCTX-M-65	extended-spectrum class A beta-lactamase CTX-M-65	core	AMR	AMR	BETA-LACTAM	CEPHALOSPORIN	ALLELEX	291	291	100.00	100.00	291	WP_013188475.1	extended-spectrum class A beta-lactamase CTX-M-65	NA	NA
NA	CP027202.2	166044	166880	-	sul1	sulfonamide-resistant dihydropteroate synthase Sul1	core	AMR	AMR	SULFONAMIDE	SULFONAMIDE	EXACTX	279	279	100.00	100.00	279	WP_000259031.1	sulfonamide-resistant dihydropteroate synthase Sul1	NA	NA
NA	CP027202.2	166877	167080	-	qacE	quaternary ammonium compound efflux SMR transporter QacE	core	STRESS	BIOCIDE	QUATERNARY AMMONIUM	QUATERNARY AMMONIUM	PARTIALX	68	115	59.13	100.00	68	WP_000679427.1	quaternary ammonium compound efflux SMR transporter QacE delta 1	NA	NA
NA	CP027202.2	169511	169897	+	bleO	bleomycin binding protein	core	AMR	AMR	BLEOMYCIN	BLEOMYCIN	BLASTX	129	134	96.27	100.00	129	WP_001242578.1	bleomycin binding protein	NA	NA
NA	CP027202.2	171971	173143	+	oqxA	multidrug efflux RND transporter periplasmic adaptor subunit OqxA	core	AMR	AMR	NITROFURAN/PHENICOL/QUINOLONE/TETRACYCLINE	NITROFURANTOIN/PHENICOL/QUINOLONE/TIGECYCLINE	BLASTX	391	391	100.00	99.74	391	WP_063865358.1	multidrug efflux RND transporter periplasmic adaptor subunit OqxA2	NA	NA
NA	CP027202.2	173170	176319	+	oqxB	multidrug efflux RND transporter permease subunit OqxB	core	AMR	AMR	NITROFURAN/PHENICOL/QUINOLONE/TETRACYCLINE	NITROFURANTOIN/PHENICOL/QUINOLONE/TIGECYCLINE	BLASTX	1050	1050	100.00	99.90	1050	WP_000347934.1	multidrug efflux RND transporter permease subunit OqxB	NA	NA
NA	CP027203.2	35234	36856	+	mcr-3.5	phosphoethanolamine--lipid A transferase MCR-3.5	core	AMR	AMR	COLISTIN	COLISTIN	ALLELEX	541	541	100.00	100.00	541	WP_089613755.1	phosphoethanolamine--lipid A transferase MCR-3.5	NA	NA
NA	CP027204.2	27645	28454	+	blaNDM-5	subclass B1 metallo-beta-lactamase NDM-5	core	AMR	AMR	BETA-LACTAM	CARBAPENEM	ALLELEX	270	270	100.00	100.00	270	WP_023408309.1	subclass B1 metallo-beta-lactamase NDM-5	NA	NA
NA	CP027204.2	28461	28823	+	ble	bleomycin binding protein Ble-MBL	core	AMR	AMR	BLEOMYCIN	BLEOMYCIN	EXACTX	121	121	100.00	100.00	121	WP_004201167.1	bleomycin binding protein Ble-MBL	NA	NA
NA	CP027205.2	288051	288479	-	silE	silver-binding protein SilE	plus	STRESS	METAL	SILVER	SILVER	EXACTX	143	143	100.00	100.00	143	AAD11743.1	silver-binding protein SilE	NA	NA
NA	CP027205.2	288733	290205	-	silS	copper/silver sensor histidine kinase SilS	plus	STRESS	METAL	COPPER/SILVER	COPPER/SILVER	BLASTX	491	491	100.00	98.37	491	SPD96882.1	copper/silver sensor histidine kinase SilS	NA	NA
NA	CP027205.2	290201	290878	-	silR	copper/silver response regulator transcription factor SilR	plus	STRESS	METAL	COPPER/SILVER	COPPER/SILVER	BLASTX	226	226	100.00	97.79	226	SPD96883.1	copper/silver response regulator transcription factor SilR	NA	NA
NA	CP027205.2	291068	292450	+	silC	Cu(+)/Ag(+) efflux RND transporter outer membrane channel SilC	plus	STRESS	METAL	COPPER/SILVER	COPPER/SILVER	BLASTX	461	461	100.00	98.05	461	SPD96884.1	Cu(+)/Ag(+) efflux RND transporter outer membrane channel SilC	NA	NA
NA	CP027205.2	292481	292831	+	silF	Cu(+)/Ag(+) efflux RND transporter periplasmic metallochaperone SilF	plus	STRESS	METAL	COPPER/SILVER	COPPER/SILVER	BLASTX	117	117	100.00	97.44	117	KGL71342.1	Cu(+)/Ag(+) efflux RND transporter periplasmic metallochaperone SilF	NA	NA
NA	CP027205.2	292948	294237	+	silB	Cu(+)/Ag(+) efflux RND transporter periplasmic adaptor subunit SilB	plus	STRESS	METAL	COPPER/SILVER	COPPER/SILVER	BLASTX	430	430	100.00	96.28	430	AAD11748.1	Cu(+)/Ag(+) efflux RND transporter periplasmic adaptor subunit SilB	NA	NA
NA	CP027205.2	294251	297394	+	silA	Cu(+)/Ag(+) efflux RND transporter permease subunit SilA	plus	STRESS	METAL	COPPER/SILVER	COPPER/SILVER	BLASTX	1048	1048	100.00	98.66	1048	AAD11749.1	Cu(+)/Ag(+) efflux RND transporter permease subunit SilA	NA	NA
NA	CP027205.2	298030	300495	+	silP	Ag(+)-translocating P-type ATPase SilP	plus	STRESS	METAL	SILVER	SILVER	BLASTX	822	824	99.64	95.14	823	AAD11750.1	Ag(+)-translocating P-type ATPase SilP	NA	NA
NA	CP027205.2	302480	304294	+	pcoA	multicopper oxidase PcoA	plus	STRESS	METAL	COPPER	COPPER	BLASTX	605	605	100.00	99.50	605	CAA58525.1	multicopper oxidase PcoA	NA	NA
NA	CP027205.2	304303	305190	+	pcoB	copper-binding protein PcoB	plus	STRESS	METAL	COPPER	COPPER	EXACTX	296	296	100.00	100.00	296	CAA58526.1	copper-binding protein PcoB	NA	NA
NA	CP027205.2	305233	305610	+	pcoC	copper resistance system metallochaperone PcoC	plus	STRESS	METAL	COPPER	COPPER	EXACTX	126	126	100.00	100.00	126	CAA58527.1	copper resistance system metallochaperone PcoC	NA	NA
NA	CP027205.2	305618	306544	+	pcoD	copper resistance inner membrane protein PcoD	plus	STRESS	METAL	COPPER	COPPER	EXACTX	309	309	100.00	100.00	309	CAA58528.1	copper resistance inner membrane protein PcoD	NA	NA
NA	CP027205.2	306602	307279	+	pcoR	copper response regulator transcription factor PcoR	plus	STRESS	METAL	COPPER	COPPER	EXACTX	226	226	100.00	100.00	226	CAA58529.1	copper response regulator transcription factor PcoR	NA	NA
NA	CP027205.2	307279	308676	+	pcoS	copper resistance membrane spanning protein PcoS	plus	STRESS	METAL	COPPER	COPPER	BLASTX	466	466	100.00	99.57	466	CAA58530.1	copper resistance membrane spanning protein PcoS	NA	NA
NA	CP027205.2	308897	309328	+	pcoE	copper resistance system metallochaperone PcoE	plus	STRESS	METAL	COPPER	COPPER	BLASTX	144	144	100.00	92.36	144	CAA58532.1	copper resistance system metallochaperone PcoE	NA	NA
NA	CP027205.2	522730	525831	-	acrF	multidrug efflux RND transporter permease subunit AcrF	plus	AMR	AMR	EFFLUX	EFFLUX	BLASTX	1034	1034	100.00	99.61	1034	AAC76298.1	multidrug efflux RND transporter permease subunit AcrF	NA	NA
NA	CP027205.2	762936	764825	+	parE_S458A	Escherichia quinolone resistant ParE	core	AMR	POINT	QUINOLONE	QUINOLONE	POINTX	630	630	100.00	99.68	630	WP_033554192.1	DNA topoisomerase IV subunit B ParE	NA	NA
NA	CP027205.2	773489	775744	+	parC_S80I	Escherichia quinolone resistant ParC	core	AMR	POINT	QUINOLONE	QUINOLONE	POINTX	752	752	100.00	99.87	752	WP_001281881.1	DNA topoisomerase IV subunit A ParC	NA	NA
NA	CP027205.2	1630243	1632867	+	gyrA_D87N	Escherichia quinolone resistant GyrA	core	AMR	POINT	QUINOLONE	QUINOLONE	POINTX	875	878	99.66	98.97	875	WP_001281243.1	DNA gyrase subunit A GyrA	NA	NA
NA	CP027205.2	1630243	1632867	+	gyrA_S83L	Escherichia quinolone resistant GyrA	core	AMR	POINT	QUINOLONE	QUINOLONE	POINTX	875	878	99.66	98.97	875	WP_001281243.1	DNA gyrase subunit A GyrA	NA	NA
NA	CP027205.2	1656914	1658014	+	ompC_R195L	Escherichia carbapenem resistant OmpC	core	AMR	POINT	BETA-LACTAM	CARBAPENEM	POINTX	367	367	100.00	94.88	371	WP_000865568.1	outer membrane porin C OmpC	NA	NA
NA	CP027205.2	1954113	1954442	+	emrE	multidrug efflux SMR transporter EmrE	plus	STRESS	BIOCIDE	EFFLUX	EFFLUX	INTERNAL_STOP	110	110	100.00	96.36	110	CAA77936.1	multidrug efflux SMR transporter EmrE	NA	NA
NA	CP027205.2	2732403	2732666	-	ariR	biofilm/acid-resistance regulator AriR	plus	STRESS	ACID	NA	NA	BLASTX	88	88	100.00	98.86	88	AAC74250.1	biofilm/acid-resistance regulator AriR	NA	NA
NA	CP027205.2	2880211	2881353	-	blaCMY-2	extended-spectrum class C beta-lactamase CMY-2	core	AMR	AMR	BETA-LACTAM	CEPHALOSPORIN	ALLELEX	381	381	100.00	100.00	381	WP_000976514.1	extended-spectrum class C beta-lactamase CMY-2	NA	NA
NA	CP027205.2	3717482	3721729	-	fdeC	inverse autotransporter adhesin FdeC	plus	VIRULENCE	VIRULENCE	NA	NA	BLASTX	1416	1416	100.00	94.21	1416	ABE05822.1	inverse autotransporter adhesin FdeC	NA	NA
NA	CP027205.2	3929074	3930849	-	ftsI_N337NYRIN	Escherichia aztreonam/cefiderocol/cephalosporin resistant FtsI	core	AMR	POINT	BETA-LACTAM	AZTREONAM/CEFIDEROCOL/CEPHALOSPORIN	POINTX	592	592	100.00	99.49	592	WP_000642196.1	penicillin-binding protein PBP3 FtsI	NA	NA
NA	CP027205.2	4001982	4003055	+	espX1	type III secretion system effector EspX1	plus	VIRULENCE	VIRULENCE	NA	NA	PARTIALX	358	473	75.69	89.66	358	ADD54679.1	type III secretion system effector EspX1	NA	NA
NA	CP027205.2	4094520	4095749	+	mdtM	multidrug efflux MFS transporter MdtM	plus	AMR	AMR	EFFLUX	EFFLUX	BLASTX	410	410	100.00	97.80	410	AAC77293.1	multidrug efflux MFS transporter MdtM	NA	NA
NA	CP027205.2	4276570	4277700	+	blaEC	BlaEC family class C beta-lactamase	plus	AMR	AMR	BETA-LACTAM	BETA-LACTAM	BLASTX	377	377	100.00	98.41	377	WP_063610930.1	extended-spectrum class C beta-lactamase EC-15	NA	NA
NA	CP027205.2	4784352	4784636	+	lpfA-O113	long polar fimbria major subunit LpfA-O113	plus	VIRULENCE	VIRULENCE	NA	NA	PARTIALX	95	190	50.00	100.00	95	AAT76975.1	long polar fimbria major subunit LpfA-O113	NA	NA
NA	CP027205.2	4784636	4784923	+	lpfA-O113	long polar fimbria major subunit LpfA-O113	plus	VIRULENCE	VIRULENCE	NA	NA	PARTIALX	96	190	50.53	100.00	96	AAP18950.1	long polar fimbria major subunit LpfA-O113	NA	NA
